{
  "type": "drone_state",
  "version": "0.2",
  "stamp": "2026-10-10T05:12:33.080Z",
  "device_id": "octo_01",
  "armed": true,
  "mode": "AUTO",
  "in_air": true,
  "latitude": 35.8243715,
  "longitude": 127.1486021,
  "altitude_msl": 60.2,
  "altitude_rel": 20.1,
  "heading_deg": 87.5,
  "gps_fix_type": 3,
  "gps_satellites": 15,
  "roll_deg": 1.2,
  "pitch_deg": -2.3,
  "yaw_deg": 2.5,
  "ground_speed_mps": 3.1,
  "climb_rate_mps": 0.0,
  "battery_voltage": 23.4,
  "battery_current": 41.2,
  "battery_percent": 78.0
}
